label,content,,,,,,,,,,,,,,,,,,
0,Mithotyn yea maybe in Germany and other Western European countries nazis are banned from everywhere , but in Bulgaria u can live , * * * * gypsies and some * * * * * * s/not much = 15-20 ppl in my town / u can dress like skin and beat punks/not much 15-20 guys / and ..... just u can do everything but if u live here u will not have money ( hehe i will cut some of my fingers if someone american come to live in Bulgaria ...,,,,,,,,,,,,,,,,
0,hello. my name is sean brennan. i live in mission kansas. i 'm looking for more people in my area to hang out with. please email me at nirvana@emailnerd.com,,,,,,,,,,,,,,,,,,
0,Seeking any good single Woman in the Fox Valley area for some conversation and maybe some romance .,,,,,,,,,,,,,,,,,,
0,Are you my White Princess ?,,,,,,,,,,,,,,,,,,
0,hi i would love to chat with u ... pm me when u are online ok ?? i am a strong aryan woman,,,,,,,,,,,,,,,,,,
0,hey everyone , i dont know really where to post this , but im new to the board and would just like to say hello to everyone. so ... hello !,,,,,,,,,,,,,,,,
0,im an irish n.s skin , id like to hear from any skin or nonskin n.s girls from around the world ! 88 ...,,,,,,,,,,,,,,,,,
0,I'm looking for any white females in the fort hood area to talk to .,,,,,,,,,,,,,,,,,,
0,I 'm also looking for friends male or female .,,,,,,,,,,,,,,,,,,
0,Unfortunately I 'm over by Houston.Funny.I was born in Bastrop , La.,,,,,,,,,,,,,,,,,
0,BTW.Are you allread in the Texas site.I can send you an invite if you 're not.We 've got over a 100 members so far .,,,,,,,,,,,,,,,,,,
0,1wolf, What is the tight referring to in your slogan .,,,,,,,,,,,,,,,,,
0,Tight as in good pals ?,,,,,,,,,,,,,,,,,,
0,Tight as in good abs ?,,,,,,,,,,,,,,,,,,
0,Tight as in do n't be a tramp ?,,,,,,,,,,,,,,,,,,
0,Just curious .,,,,,,,,,,,,,,,,,,
0,I have an awesome tattooist in the burbs of Chicago ...,,,,,,,,,,,,,,,,,,
0,He has won many awards and has been featured in Tatto magazine .,,,,,,,,,,,,,,,,,,
0,Lass,,,,,,,,,,,,,,,,,,
0,sounds like a good thing ....... I 'll pitch in for food .... but if we meet in a park or something like that .. somebody please .... do n't forget the beer permit ...... lol,,,,,,,,,,,,,,,,,,
0,im from nepa not looking for a relationship just someone to talk to my brother goes to ps in state college so im down there quite often xxboobearxx@aol.com,,,,,,,,,,,,,,,,,,
0,i have never been noticed in a crowd for my tattoos.i have never seen anyone walking in a crowd just looking and concentrating on people with tattoos .,,,,,,,,,,,,,,,,,,
0,hey how ya doin , my buddy showed me this place last night and ive been checkin it out , im getting ready to move to alabama later this month if i can get my yahoo to connect ill send ya a message , might half to log into chat thow .,,,,,,,,,,,,,,,
0,The Great Northwest Oktoberfest | Whitefish , MT 59937 Join us in beautiful Whitefish , Montana for two weekends of authentic German beer , food , music and fun - Montana-style !,,,,,,,,,,,,,,
0,Sept 26-28 & Oct 3-5 , 2013 The Great Northwest Oktoberfest - Pioneer Little Europe Community Information & Discussion The Great Northwest Oktoberfest - Pioneer Little Europe Community Information & Discussion,,,,,,,,,,,,,,,,,
0,I've lost count of the many SF MODs who wanted me to leave .,,,,,,,,,,,,,,,,,,
0,Most of these MODs are gone now .,,,,,,,,,,,,,,,,,,
0,I out lasted them because I follow SF rules .,,,,,,,,,,,,,,,,,,
0,When Don Black says I am not welcome at SF I will leave .,,,,,,,,,,,,,,,,,,
0,Thank you so much for the PLE link !,,,,,,,,,,,,,,,,,,
0,The points they raise ought to be brought up far more often on SF .,,,,,,,,,,,,,,,,,,
0,We are looking to close on the land soon thats all I can say about the location , but I will tell you it will be in the southeast of the USA .,,,,,,,,,,,,,,,,,
0,That will narrow it down for most folk .,,,,,,,,,,,,,,,,,,
0,To found a white community you must be in charge of all the elements that make up a community .,,,,,,,,,,,,,,,,,,
0,You cannot just assimilate one city block at a time .,,,,,,,,,,,,,,,,,,
0,Does that make sense ?,,,,,,,,,,,,,,,,,,
0,To be honest I have not heard in yrs of any skinheads beating anyone up what a shame it should be an everyday event .,,,,,,,,,,,,,,,,,,
0,The last time I heard of anyone beating anyone up is when the guys down in miami from wctoc were arrested for doing there duty .,,,,,,,,,,,,,,,,,,
0,What are the best ways to start you own white community , set up your own currency or other methods of trade with other white communities in order to support your white community ?,,,,,,,,,,,,,,,,,
0,I find it kind of funny that they include no women in that picture. perhaps they didnt realize women are integral to a nation. otherwise i think its a great idea and wish them best of luck .,,,,,,,,,,,,,,,,,,
0,No, I do n't Promote Nordic Superiority .,,,,,,,,,,,,,,,,,
0,While My mother has Blond hair brown eye 's and my father Brown hair blue eye 's and i inherited my brown hair blue eye 's from my father .,,,,,,,,,,,,,,,,,,
0,I do n't think that any white person with brown hair brown eye 's is infirior to me .,,,,,,,,,,,,,,,,,,
0,forming one little place ... a village or a small community that is purely White and that no other race can enter or interact with unless it has majority consent .,,,,,,,,,,,,,,,,,,
0,It may have had something to do with me still working on it , so I entered your vote through the moderator 's edit option .,,,,,,,,,,,,,,,,,
0,I miss my mark if the movie Jack London was n't shown at the The Jack London Literary Prize Banquet .,,,,,,,,,,,,,,,,,,
0,Anyone know ?,,,,,,,,,,,,,,,,,,
0,Please notice my lengthy thread showing just a small portion of the jobs available in this area .,,,,,,,,,,,,,,,,,,
0,Also you can check out this website .,,,,,,,,,,,,,,,,,,
0,http://wsd.dli.mt.gov/local/kalispell/,,,,,,,,,,,,,,,,,,
0,TY!,,,,,,,,,,,,,,,,,,
0,BTW .. update coming soon with info on my drive back to Florida .,,,,,,,,,,,,,,,,,,
0,In August , I will be driving up a completely different way .,,,,,,,,,,,,,,,,,
0,Yes, it is a symbol in the past and has no place in the present because when it is used for the advancement of white nationalism it proves to only hold us back so thus it shouldn t be used and should go down in history where it belongs .,,,,,,,,,,,,,,,,,
0,There have been several bears , both grizzly and black , caught or killed here in C-Falls in the last month .,,,,,,,,,,,,,,,,
0,In fact , it looks like almost a dozen black bears have been euthanized all over western Montana due to illegal feeding . Grizzly bear relocated in NW Montana | KRTV.com | Great Falls , Montana,,,,,,,,,,,,,,,,
0,I had to ride a bus downtown in the mid 70s , to take the test for my ham radio license .,,,,,,,,,,,,,,,,,
0,I got stuck next to a really huge black woman who stunk to high heaven , and spent the entire ride with my face as close to the window as I could get .,,,,,,,,,,,,,,,,,
0,I have n't rode a bus since .,,,,,,,,,,,,,,,,,,
0,I plan on making a trip to Kalispell in early August .,,,,,,,,,,,,,,,,,,
0,Thanks for the commentary Mjodr , now I 'm getting excited !,,,,,,,,,,,,,,,,,
0,I just passed Devil ' s Lake , ND where the flooding is .,,,,,,,,,,,,,,,,,
0,It 's massive .,,,,,,,,,,,,,,,,,,
0,They are moving the town of Church 's Falls .,,,,,,,,,,,,,,,,,,
0,No pictures yet .,,,,,,,,,,,,,,,,,,
0,Very good .,,,,,,,,,,,,,,,,,,
0,Hats off to the Knight 's Party !,,,,,,,,,,,,,,,,,,
0,For more on The Knight 's Party .,,,,,,,,,,,,,,,,,,
0,Welcome to the Ku Klux Klan : Knights Party,,,,,,,,,,,,,,,,,,
0,This looks like a nice little town ( on paper ) .,,,,,,,,,,,,,,,,,,
0,Lumberton , Texas in Hardin County .,,,,,,,,,,,,,,,,,
0,As of 2009 11,943 people 92.9 % White 4.7 % Hispanic .9 % Mixed .7 % Asian .4 % Black .3 % American Indian .04 % Other race alone Median income is $ 66,115 .,,,,,,,,,,,,,,,,
0,I found this place because I was looking up Kountze ( same county ) .,,,,,,,,,,,,,,,,,,
0,Their cheerleaders went to court for their First Amendment rights in putting Bible verses on their football game banners & won .,,,,,,,,,,,,,,,,,,
0,Kountze is ~ 70 % White , 23 % Black , & 5 % Hispanic , so I looked in the area. in a good way. source : City Data,,,,,,,,,,,,,,,
0,This is a petition in opposition to the banning of Golden Dawn .,,,,,,,,,,,,,,,,,,
0,Show your support for Golden Dawn and sign the petition , https : //secure.avaaz.org/en/petition ... _ free _ country/,,,,,,,,,,,,,,,,,
0,Thanks both of you for that .,,,,,,,,,,,,,,,,,,
0,I have seen these things popping up more and more on youtube and I like it .,,,,,,,,,,,,,,,,,,
0,And nice website also,,,,,,,,,,,,,,,,,,
0,You are not worth my time kid so this is the last answer you will get from me because you are now on my ignore list as are the rest of the losers that stayed with jenkins .,,,,,,,,,,,,,,,,,,
0,I run a small crew of Skinheads in the Vancouver / Portland area .,,,,,,,,,,,,,,,,,,
0,We distribute propaganda , educate people , help whites , employ whites , post online , network , keep our neighborhoods safe , etc ...,,,,,,,,,,,
0,Move the fight over to the other thread .,,,,,,,,,,,,,,,,,,
0,Let 's keep fights under one roof over there and keep this one fight free .,,,,,,,,,,,,,,,,,,
0,Planet of the apes .,,,,,,,,,,,,,,,,,,
0,If anyone wants to watch sports , whether white or non-white , let them .,,,,,,,,,,,,,,,,
0,The only sports I watch are the 99 % white leagues my 6 white grandchildren play in .,,,,,,,,,,,,,,,,,,
0,Good.,,,,,,,,,,,,,,,,,,
0,Now that the little troll is no longer going to nip at my pant 's leg , lets now look at the platform :,,,,,,,,,,,,,,,,,
0,Why do you have the need to celebrate anyone 's birthday that day anyway ?,,,,,,,,,,,,,,,,,,
0,I plan on celebrating being White that entire 24 hours .,,,,,,,,,,,,,,,,,,
0,There is no greater reason to be joyous than that .,,,,,,,,,,,,,,,,,,
0,This is a special thanks to all those who had the patience to wait it out while I constructed this article .,,,,,,,,,,,,,,,,,,
0,And that small group , properly radicalized , is the target audience of our propaganda efforts and shall be the nucleus of the new order of the ages,,,,,,,,,,,,,,,,
0,No figures are available because none are made public .,,,,,,,,,,,,,,,,,,
0,It is certainly enough money to keep hundreds of jews employed by over a dozen companies involved in the certification process .,,,,,,,,,,,,,,,,,,
0,We 're also looking for people to sign our petition and give their opinions on the topic .,,,,,,,,,,,,,,,,,,
0,http://www.getmycountryback.com,,,,,,,,,,,,,,,,,,
0,Strong, firm parents who bring up their children with Values are a good breeding ground for future leaders .,,,,,,,,,,,,,,,,,
0,We ought to give this material a better edge for their advancement in life , business and politics !,,,,,,,,,,,,,,,,,
0,Yeah, it surprised me .,,,,,,,,,,,,,,,,,
0,Wisconsin should have way more than what this map shows .,,,,,,,,,,,,,,,,,,
0,I guess most of them keep to themselves .,,,,,,,,,,,,,,,,,,
0,That's a good point , awake777 .,,,,,,,,,,,,,,,,,
0,Turn off all pop-up blockers , Zone Alarm , and so on .,,,,,,,,,,,,,,,,
0,KOGO 's online radio software is blocked by many of these blockers .,,,,,,,,,,,,,,,,,,
0,I hope we 're above that sort of thing .,,,,,,,,,,,,,,,,,,
0,Besides anyone really concerned about privacy and security will regularly scan for and remove any spyware on their computers .,,,,,,,,,,,,,,,,,,
0,well i was thinking human and i agree i think there could be some good in it providing it was wortrh it !,,,,,,,,,,,,,,,,,,
0,Thanks, but I 'll pass .,,,,,,,,,,,,,,,,,
0,I work in close proximity to more of them than I care to .,,,,,,,,,,,,,,,,,,
0,I watch very little television and what little I do watch sure as hell wo n't be spent as a study of the common * * * * * * s psyche .,,,,,,,,,,,,,,,,,,
0,Or a classified section for employment or contract services .,,,,,,,,,,,,,,,,,,
0,Actual names and places could be transmitted using the Private Message function .,,,,,,,,,,,,,,,,,,
0,We had about 500 people in DC last year for a rally and concert and several dozen more at a rally the same day in Topeka .,,,,,,,,,,,,,,,,,,
0,The DC rally was organized by the National Alliance but lots of other groups and non-members were there as well , the Topeka rally was a joint WCotC/National Socialist rally .,,,,,,,,,,,,,,,,,
0,I think that it is fair to say that the National Alliance is a secular organization that has taken a specific stance against multicultural Christianity for political reasons and has also had prominent members who have promoted non-Christian religions or spiritual paths .,,,,,,,,,,,,,,,,,,
0,This is just some horny dumb kid .,,,,,,,,,,,,,,,,,,
0,We have more than a few of them , but thankfully not every kid here is like this .,,,,,,,,,,,,,,,,,
0,The Philippines ?,,,,,,,,,,,,,,,,,,
0,Jesus Christ ...,,,,,,,,,,,,,,,,,,
0,Look at that evil slave ship with the evil slave master forcing the blacks to leave their utopian paradise in Africa http://www.europeandailynews.org/wp-...anmigrants.jpg,,,,,,,,,,,,,,,,,,
0,I have never heard a song by this idiot negro but the press is always talking about everything he says or does .,,,,,,,,,,,,,,,,,,
0,Who TF cares ?,,,,,,,,,,,,,,,,,,
0,Where do you get that ?,,,,,,,,,,,,,,,,,,
0,So if a child asks his parents what are they celebrating the parents will answer `` we are celebrating secularism '' ?,,,,,,,,,,,,,,,,,,
0,I just do n't have the extra concern to care about Tibet ...,,,,,,,,,,,,,,,,,,
0,It is called priorities .,,,,,,,,,,,,,,,,,,
0,Look who is talking .,,,,,,,,,,,,,,,,,,
0,For some reason these immigrants do n't have the same bad attitudes US blacks do .,,,,,,,,,,,,,,,,,,
0,Although , the water gun had already been invented , so IMO its dumb to call it an `` invention '' . super soaker inventor - YouTube,,,,,,,,,,,,,,,,
0,Can we have a warning before pictures like that are posted on here please ?,,,,,,,,,,,,,,,,,,
0,Or hide it behind a link or something ?,,,,,,,,,,,,,,,,,,
0,wtf is feminist about a child speaking out against being trafficked to an old pedophile or anyone else objecting to pedophilia ?,,,,,,,,,,,,,,,,,,
0,MORON,,,,,,,,,,,,,,,,,,
0,WOW!!!,,,,,,,,,,,,,,,,,,
0,Hey negro geniuses !,,,,,,,,,,,,,,,,,,
0,We're speaking out against our race being destroyed and this guy is making up hypothetical scenarios about snack time and windowless rooms .,,,,,,,,,,,,,,,,,,
0,Unreal .,,,,,,,,,,,,,,,,,,
0,I can find my way out of the building on my own , thank you .,,,,,,,,,,,,,,,,,
0,We both know you 'll just wait for me to figure it out and then later claim it was really you all along .,,,,,,,,,,,,,,,,,,
0,Who said we invented literally EVERYTHING useful ?,,,,,,,,,,,,,,,,,,
0,And sorry brown-man , your people did not invent ' non-violence ' .,,,,,,,,,,,,,,,,,
0,I suppose it is okay for everyone else to call me anything they want .,,,,,,,,,,,,,,,,,,
0,I reported dozens of posts but who knows if anything was done .,,,,,,,,,,,,,,,,,,
0,Isn't wonderful to both be living in a free nation with a First Amendment where you can have your dictionary definition that works for you and I can have my dictionary definition that works for me ?,,,,,,,,,,,,,,,,,,
0,Its a `` win-win '' situation .,,,,,,,,,,,,,,,,,,
0,I was wondering the same thing .,,,,,,,,,,,,,,,,,,
0,Maybe it was because of his repeated personal attacks , in violation of the rules of the forum .,,,,,,,,,,,,,,,,,
0,The black gene always comes out to be the dominant gene .,,,,,,,,,,,,,,,,,,
0,I have yet to see a half breed that came out dominantly White .,,,,,,,,,,,,,,,,,,
0,There is plenty of genetic diversity among white people .,,,,,,,,,,,,,,,,,,
0,Shame on you for using such an ignorant and laughable argument .,,,,,,,,,,,,,,,,,,
0,Whites are not all genetic copies of one another .,,,,,,,,,,,,,,,,,,
0,We have a good reason for it to but you people want to get in the way of it .,,,,,,,,,,,,,,,,,,
0,Also it 's NOT genocide. stop calling it that .,,,,,,,,,,,,,,,,,,
0,WOW!,,,,,,,,,,,,,,,,,,
0,Thank you so much for enlightening us mystery guest !,,,,,,,,,,,,,,,,,,
0,What happens to a domesticated animal forced to fend for itself ?,,,,,,,,,,,,,,,,,,
0,The above poster is correct when we stop supporting then they 're in terrible danger .,,,,,,,,,,,,,,,,,,
0,Blacks built the Pyramids and the White House .,,,,,,,,,,,,,,,,,,
0,The Lone Ranger was black Annie was a little black girl There were black Vikings Spartacus was black Hercules was black The jews have two choices for past historical figures Make them to be black or make them out to be crazy genocide White maniacs like in Christopher Columbus,,,,,,,,,,,,,,,,,,
0,Putting it out there that I am in for a meet up , feel free to private message me .,,,,,,,,,,,,,,,,,
0,I am located in Vancouver,,,,,,,,,,,,,,,,,,
0,Someone always gets shot at that event , this year it 'll probably be much worse .,,,,,,,,,,,,,,,,,
0,We do n't have black riots in Texas , and the blacks know why .,,,,,,,,,,,,,,,,,
0,But one day there was a group of big black females gathered in front of the Houston city hall .,,,,,,,,,,,,,,,,,,
0,HPD immediately responded with a few officers , but were confused as to what they should do about this .,,,,,,,,,,,,,,,,,
0,When the local TV station ran the video and explanation of the event , the news anchors could not keep a straight face and its all broke down into uncontrollable laughter .,,,,,,,,,,,,,,,,,
0,The big black females where shouting `` We want REAL teachers for our chilrens , we do n't want dem blacks you ben sendin us , we want REAL teachers jus like yo got in dem white people 's schools ! '',,,,,,,,,,,,,,,,
0,Well we wo n't stand for that no more !,,,,,,,,,,,,,,,,,,
0,"We want real teachers , white teachers , just like you have in the white schools . """,,,,,,,,,,,,,,,,,,
0,I think having our own venue for our gatherings and events has helped build a good community of like minded people and with a comfortable place for us to promote our message to the people in attendance .,,,,,,,,,,,,,,,,,,
0,You should try the same thing where you are at and build things up there,,,,,,,,,,,,,,,,,,
0,Half of winning a fight is attitude .,,,,,,,,,,,,,,,,,,
0,You are NOT a worthless white .,,,,,,,,,,,,,,,,,,
0,Holocaust Handbooks - Educate Yourself - YouTube Holocaust Handbooks is the world 's premiere Revisionist book series .,,,,,,,,,,,,,,,,,,
0,Download Free PDF and Kindle versions or order paperback hardcopies .,,,,,,,,,,,,,,,,,,
0,Visit http://HolocaustHandbooks.com today,,,,,,,,,,,,,,,,,,
0,Try here Amazon.com.,,,,,,,,,,,,,,,,,,
0,I see they have one for $ 116 .,,,,,,,,,,,,,,,,,,
0,Also available with other on line sources https : //www.amazon.com/s / ? ie = UTF8 & ke ... l _ 175hzupf6t _ b,,,,,,,,,,,,,,,,,,
0,Best wishes with this important new project , from a Pagan perspective it is encouraging to see renewed interest in pre-Christian European folk heritage .,,,,,,,,,,,,,,,,,
0,So Trudeau is sneaking them in like that ?,,,,,,,,,,,,,,,,,,
0,Could Trudeau 's buddies have set the fires for him at his request ?,,,,,,,,,,,,,,,,,,
0,There have been court cases for asylum by white South Africans in Canada that the South African government has spent millions fighting ... though they have not spent a cent on the 300 asylum applications by blacks in the US ...,,,,,,,,,,,,,,,,,,
0,That is a blessing and a curse at the same time !,,,,,,,,,,,,,,,,,,
0,Lol,this happened in the neighborhood I just moved out of !,,,,,,,,,,,,,,,,,
0,I worked in that McDonald 's when I was 18 years old !,,,,,,,,,,,,,,,,,,
0,I have SeaMonkey open right now , I 've had it on my computer for about a week now , but I just ca n't get used to using it .,,,,,,,,,,,,,,,,
0,Exactly!,,,,,,,,,,,,,,,,,,
0,Our people do n't need to feel down about all this and neither do we need to turn off new member prospects from this fine place so a little less crying and a little more doing is called for .,,,,,,,,,,,,,,,,,,
0,Most importantly draw that mental line in your head and once crossed unleash hell .,,,,,,,,,,,,,,,,,,
0,I find most people wait to long to react in a physical encounter .,,,,,,,,,,,,,,,,,,
0,I'm not EVEN gonna try and lie , if I had money , I 'd probably have a whole safe full of these !,,,,,,,,,,,,,,,,
0,They breed faster .,,,,,,,,,,,,,,,,,,
0,Meaning every explanation you 've given of what a haplogroup tends to be is inaccurate they mark genetic ancestors the mutations will be in the chromosomes .,,,,,,,,,,,,,,,,,,
0,Yes and if I were a jewish-supremacist I 'd want it that way , too .,,,,,,,,,,,,,,,,,
0,Dumb goyim are a good revenue source .,,,,,,,,,,,,,,,,,,
0,unfortunately the jew controlled government will never allow this labeling every attempt for this `` racist '' even though there are hundreds of negro exclusive schools around this country .,,,,,,,,,,,,,,,,,,
0,Thank you for your input .,,,,,,,,,,,,,,,,,,
0,Most enlightening .,,,,,,,,,,,,,,,,,,
0,I appreciate your contributions here. have been a fan for a long time .,,,,,,,,,,,,,,,,,,
0,Which is why you build them far away from silos , cities and targets of interest to a 1st world nuclear adversary .,,,,,,,,,,,,,,,,,
0,That letter would fall on deaf ears .,,,,,,,,,,,,,,,,,,
0,It might get the sender , however , on a list of potential troublemakers to watch .,,,,,,,,,,,,,,,,
0,Woodstock is flanked by multicultural hell London and multicultural hell Kitchener , its a hopeless cause .,,,,,,,,,,,,,,,,,
0,Yep, forgot I had the thing wrapped in a jacket , went to grab the jacket and the thing came tumblin ' out !,,,,,,,,,,,,,,,,
0,I can not call the government by an appropriate name .,,,,,,,,,,,,,,,,,,
0,I was brought up to believe that ladies do not use such language,,,,,,,,,,,,,,,,,,
0,We say here that if we want to be lied to just watch the news !,,,,,,,,,,,,,,,,,,
0,Like you I like certain movies , tv series I absolutely abhor British telly in particular as they are always and in all ways promoting race mixing or homosexuality .,,,,,,,,,,,,,,,,,
0,I've gotten fatter over the years .,,,,,,,,,,,,,,,,,,
0,I used to be bikini model skinny .,,,,,,,,,,,,,,,,,,
0,I also have some acne on the side of my face I hide it with my long hair .,,,,,,,,,,,,,,,,,,
0,I read a web site , not too long ago , called the TFP.org.,,,,,,,,,,,,,,,,
0,It has a Camp for fathers and sons , called the `` Call to Chivalry '' .,,,,,,,,,,,,,,,,,
0,The outline for the events for the boys , and their fathers , was interesting .,,,,,,,,,,,,,,,,
0,You may want to read more about it .,,,,,,,,,,,,,,,,,,
0,Yea I hate it when geysers of blood come shooting up from graves .,,,,,,,,,,,,,,,,,,
0,Last weekend I was trying to lay some flowers on my grandad 's grave when suddenly , a blood geyser .,,,,,,,,,,,,,,,,,
0,It happens with animals too , I bought a chicken to cook on my way home from the graveyard and popped it in the fridge for the next day .,,,,,,,,,,,,,,,,,
0,Later I went to get a beer and when I opened the door , yep you guessed it , blood geyser .,,,,,,,,,,,,,,,,
0,Also , my neighbour 's dog has poison teeth .,,,,,,,,,,,,,,,,,
0,I left Stormfront because I got tired of the petty bickering .,,,,,,,,,,,,,,,,,,
0,I came back because it looked like things had improved .,,,,,,,,,,,,,,,,,,
0,Now it 's gone back to the way it was when I left .,,,,,,,,,,,,,,,,,,
0,Is it any wonder why the antis laugh at us ?,,,,,,,,,,,,,,,,,,
0,Any religion that is forced is against freewill given by God .,,,,,,,,,,,,,,,,,,
0,Those who do n't believe are free to walk away and those who do believe are not forced against God 's will .,,,,,,,,,,,,,,,,,,
0,Whites should not be forced in atheistic view in-kind .,,,,,,,,,,,,,,,,,,
0,Y!,,,,,,,,,,,,,,,,,,
0,SPORTS A group of MIT grads are launching a high-tech product designed to turn any bicycle into an electric-hybrid vehicle .,,,,,,,,,,,,,,,,,,
0,Y !,,,,,,,,,,,,,,,,,,
0,SPORTS,,,,,,,,,,,,,,,,,,
0,Just as the bbc begins its campaign to stay in the eu and forever change the racial demographic of the UK and Europe forever .,,,,,,,,,,,,,,,,,,
0,I posted this on SF a couple of years back .,,,,,,,,,,,,,,,,,,
0,The title was , `` What It 's Like to Teach Black Kids . '',,,,,,,,,,,,,,,,,
0,Hitler was about as Jewish as a Negro is a Chinaman .,,,,,,,,,,,,,,,,,,
0,People who utter such garbage such get a brain transplant .,,,,,,,,,,,,,,,,,,
0,So happy you remind me this I have a little altar portraying a bronze buste of Beethoven on my bedside table along with one of Wagner ( he was Beethovenian fan too ),,,,,,,,,,,,,,,,,,
0,My sentiments exactly .,,,,,,,,,,,,,,,,,,
0,We need to focus on mobilizing Europoid minds and using this science and building on it to save our from extinction and to Least Concerned status !,,,,,,,,,,,,,,,,,,
0,Lars Andersen simply must be cast as an Elf by Peter Jackson in new Hobbit Lord Of The Rings movies .,,,,,,,,,,,,,,,,,,
0,Make it happen !,,,,,,,,,,,,,,,,,,
0,I was at a gas station last week , A guy came up to me too fast and too close and I almost went for my knife but at the last second I could see he meant no harm , then he asked for directions .,,,,,,,,,,,,,,,,
0,I told him how to go and then said , you ar n't from around here , are ya ? lol,,,,,,,,,,,,,,,,
0,The churches in my city are full of liberal school teachers .,,,,,,,,,,,,,,,,,,
0,They wo n't talk to me anymore and I wo n't go to church with them anymore .,,,,,,,,,,,,,,,,,,
0,Cool, but he is short with his draw , and the draw weight looks light too .,,,,,,,,,,,,,,,,
0,Military archery and speed shooting videos - a little rant - YouTube,,,,,,,,,,,,,,,,,,
0,Listening now .,,,,,,,,,,,,,,,,,,
0,7 minutes in , and it 's gorgeous .,,,,,,,,,,,,,,,,,
0,And I like a slight tape hiss ( or needle crackle ) in a vintage recording , though it disappears when the music gets louder .,,,,,,,,,,,,,,,,,
0,Thanks for the good stuff on here to show my kids .,,,,,,,,,,,,,,,,,,
0,We had Dresden remembrance last year and will again this year,,,,,,,,,,,,,,,,,,
0,Your medical factors come in to play .,,,,,,,,,,,,,,,,,,
0,Such as a person with one arm , wheel chair ect .,,,,,,,,,,,,,,,,,
